{
  "format": "face-unlock-enrollment-manifest",
  "format_version": 1,
  "created_at": "2026-08-19T00:00:00Z",
  "updated_at": "2026-08-19T00:00:00Z",
  "user": {
    "uid": 1000,
    "username": "example-user"
  },
  "model": {
    "embedding_model_id": "embedding-stub-v1",
    "detector_model_id": "none",
    "embedding_dim": 128,
    "input_size": [
      112,
      112
    ],
    "preprocessing": {
      "color_order": "RGB",
      "normalization": "0_to_1",
      "alignment": "not_implemented"
    }
  },
  "template": {
    "encrypted_template_path": "~/.local/share/face-unlock/template.enc",
    "encryption": "libsodium_crypto_secretbox",
    "contains_raw_images": false,
    "contains_embeddings": true,
    "key_storage": "not_implemented"
  },
  "quality": {
    "training_samples_total": 0,
    "heldout_samples_total": 0,
    "heldout_validation_passed": false,
    "lowest_heldout_similarity": null,
    "required_heldout_similarity": null,
    "pose_slots": {
      "center": false,
      "left": false,
      "right": false,
      "up": false,
      "down": false
    }
  },
  "privacy": {
    "raw_images_saved": false,
    "face_crops_saved": false,
    "telemetry_enabled": false,
    "consent_version": "not_implemented"
  },
  "status": {
    "enrollment_complete": false,
    "real_biometric_template": false,
    "placeholder_only": true
  }
}
